{
  "task": {
    "kind": "requirement",
    "goal": "给列表页加一个筛选器",
    "requirement": "给列表页加一个筛选器",
    "diffRef": null
  },
  "project": {
    "name": "@aafe/agent-runtime",
    "commit": "558505be872d",
    "knowledgeOutput": ".aafe"
  },
  "architecture": {
    "modules": [],
    "dependencies": []
  },
  "affectedFiles": [],
  "affectedModules": [],
  "affectedFeatures": [],
  "dataFlows": [],
  "businessFlows": [],
  "tests": [],
  "risk": "low",
  "confidence": 0.4,
  "constraints": [
    "AAFE analysis is advisory; verify each claim against the cited file before editing.",
    "Do not change files outside the affected modules without re-running impact analysis."
  ],
  "evidence": [],
  "recommendedChanges": [],
  "tokenEstimate": 166,
  "truncated": []
}
